Asiago,"Asiago is an Italian cow's milk cheese that can assume different textures, according to its aging, from smooth for the fresh Asiago (Asiago Pressato) to a crumbly texture for the aged cheese (Asiago d'allevo), the flavor of which is reminiscent of Parmesan",Placeholder
Brie,"Brie is a soft cow's-milk cheese named after Brie, the French region from which it originated (roughly corresponding to the modern département of Seine-et-Marne). It is pale in color with a slight grayish tinge under a rind of white mold.",Placeholder
Cheddar,"Cheddar cheese is a relatively hard, off-white (or orange if spices such as annatto are added), sometimes sharp-tasting (i.e., bitter[1]), natural cheese. Originating in the British village of Cheddar in Somerset,[2] cheeses of this style are produced beyond this region and in several countries around the world.",Placeholder
Colby,Colby is a semi-hard cow's milk cheese from the United States. It is similar to Monterey Jack.,Placeholder
Feta,"Feta is a brined curd white cheese made in Greece from sheep's milk, or from a mixture of sheep and goat's milk. Similar brined white cheeses produced in Europe are often made partly or wholly of cow's milk, and they are also sometimes called feta. It is a crumbly aged cheese, commonly produced in blocks, and has a slightly grainy texture.",Placeholder
Goat,"Goat cheese, goats' cheese, or chèvre, is cheese made from goat's milk.  In the most simple form, goat cheese is made by allowing raw milk to naturally curdle, and then draining and pressing the curds.",Placeholder
Swiss,"Swiss cheese is a generic name in North America for several related varieties of cheese, mainly of North American manufacture, which resemble Emmental cheese, a yellow, medium-hard cheese that originated in the area around Emmental, in Switzerland. Some types of Swiss cheese have a distinctive appearance, as the blocks of the cheese are riddled with holes known as ""eyes"".",Placeholder
